{"generatedAtUnixSeconds":1791826540,"officialPublishers":[{"extensionPointIdentifiers":["com.torrekie.battman.analytics.card.v1"],"keyIdentifier":"db3ca3a6dee20d278510d7ac806234c05a3fa700f2179bfffbe3108d1a671fbb","pluginIdentifiers":["com.torrekie.battman.plugin.charge-gauge"],"publicKeyX963Base64":"BM4rE2KYY2kuA4W+UzpmPK1X2mvrsxjGO++x/2zDEJcOpJ4QJK2DAXykETkKHIrHWX4vy98yCRfujIKXmPKaSrw="}],"revokedKeyIdentifiers":[],"schemaVersion":1,"sequence":1}
